{
  "schema_version": "0.1.0",
  "dataset_type": "logistics",
  "provider": {
    "id": "hanjin",
    "name": "Hanjin",
    "category": "logistics",
    "country_codes": [
      "KR"
    ]
  },
  "coverage": {
    "markets": [
      "KR"
    ],
    "currency": "KRW",
    "status": "draft"
  },
  "fee_structures": [
    {
      "id": "parcel-price-lookup",
      "name": "Parcel fee lookup",
      "status": "draft",
      "basis": "Personal small-volume parcel, size, product value, and region",
      "value": {
        "type": "calculator_reference",
        "surcharges": [
          {
            "area": "island_remote",
            "amount": 5000,
            "currency": "KRW"
          },
          {
            "area": "jeju",
            "amount": 3000,
            "currency": "KRW"
          }
        ]
      },
      "conditions": [
        "Base price must be calculated in official lookup."
      ],
      "source_ref_ids": [
        "hanjin-fee-lookup"
      ],
      "notes": "Official source includes surcharge notes."
    }
  ],
  "settlement_rules": [
    {
      "id": "carrier-billing",
      "name": "Carrier billing cycle",
      "status": "starter",
      "basis": "Carrier contract and invoicing policy",
      "value": null,
      "conditions": [
        "Contract-specific."
      ],
      "source_ref_ids": [
        "hanjin-fee-lookup"
      ],
      "notes": "Not verified."
    }
  ],
  "shipping_costs": [
    {
      "id": "domestic-shipping",
      "name": "Domestic shipping cost",
      "status": "draft",
      "basis": "Parcel size, product value, and destination",
      "value": {
        "type": "calculator_reference"
      },
      "conditions": [
        "Use official lookup before quoting a price."
      ],
      "source_ref_ids": [
        "hanjin-fee-lookup"
      ],
      "notes": "Official lookup source."
    }
  ],
  "return_costs": [
    {
      "id": "return-pickup",
      "name": "Return pickup cost",
      "status": "starter",
      "basis": "Return pickup policy and contract",
      "value": null,
      "conditions": [
        "Return pickup may differ from outbound shipping."
      ],
      "source_ref_ids": [
        "hanjin-fee-lookup"
      ],
      "notes": "Not verified."
    }
  ],
  "metadata": {
    "version": "0.1.0",
    "status": "draft",
    "license": "Apache-2.0",
    "last_reviewed": "2026-06-15",
    "maintainers": [
      "Solverine"
    ],
    "ai_usage_notes": "Use only rules whose status is reviewed or draft with official source references. Do not infer missing category, settlement, shipping, return, or advertising values.",
    "verified_scope": "Official Hanjin fee lookup source and surcharge notes. Base calculated prices are not stored."
  },
  "source_references": [
    {
      "id": "hanjin-fee-lookup",
      "title": "Hanjin parcel fee lookup",
      "publisher": "Hanjin",
      "url": "https://www.hanjin.com/kor/CMS/DeliveryMgr/FeeSch.do?mCode=MN051",
      "accessed_at": "2026-06-15",
      "reliability": "official",
      "notes": ""
    }
  ],
  "version_history": [
    {
      "version": "0.1.0",
      "released_at": "2026-06-15",
      "changes": [
        "Initial starter economics dataset shell."
      ]
    },
    {
      "version": "0.2.0",
      "released_at": "2026-06-15",
      "changes": [
        "Added source-backed verification status and official-source references.",
        "Materialized representative official values where public sources were confirmed.",
        "Kept unverified or account-specific values as starter/null to prevent unsafe agent use."
      ]
    }
  ]
}
