{
  "schema_version": "0.1.0",
  "dataset_type": "payments",
  "provider": {
    "id": "kcp",
    "name": "KCP",
    "category": "payments",
    "country_codes": [
      "KR"
    ]
  },
  "coverage": {
    "markets": [
      "KR"
    ],
    "currency": "KRW",
    "status": "starter"
  },
  "fee_structures": [
    {
      "id": "payment-processing-fee",
      "name": "Payment processing fee",
      "status": "starter",
      "basis": "Payment method, merchant contract, and transaction amount",
      "value": null,
      "conditions": [
        "Direct official source required."
      ],
      "source_ref_ids": [
        "official-provider-docs"
      ],
      "notes": "No official value stored."
    }
  ],
  "settlement_rules": [
    {
      "id": "merchant-settlement",
      "name": "Merchant settlement timing",
      "status": "starter",
      "basis": "Payment method and merchant contract",
      "value": null,
      "conditions": [
        "Direct official source required."
      ],
      "source_ref_ids": [
        "official-provider-docs"
      ],
      "notes": "No official value stored."
    }
  ],
  "shipping_costs": [
    {
      "id": "not-applicable",
      "name": "Shipping cost not applicable",
      "status": "starter",
      "basis": "Payment processor economics",
      "value": null,
      "conditions": [
        "Shipping costs are outside payment processing scope."
      ],
      "source_ref_ids": [
        "official-provider-docs"
      ],
      "notes": "Common dataset compatibility placeholder."
    }
  ],
  "return_costs": [
    {
      "id": "refund-processing-cost",
      "name": "Refund or cancellation processing cost",
      "status": "starter",
      "basis": "Payment method and refund policy",
      "value": null,
      "conditions": [
        "Direct official source required."
      ],
      "source_ref_ids": [
        "official-provider-docs"
      ],
      "notes": "No official value stored."
    }
  ],
  "metadata": {
    "version": "0.1.0",
    "status": "starter",
    "license": "Apache-2.0",
    "last_reviewed": "2026-06-15",
    "maintainers": [
      "Solverine"
    ],
    "ai_usage_notes": "Use only rules whose status is reviewed or draft with official source references. Do not infer missing category, settlement, shipping, return, or advertising values.",
    "verified_scope": "No direct official NHN KCP public fee table was materialized in this pass. Keep unverified."
  },
  "source_references": [
    {
      "id": "official-provider-docs",
      "title": "Official NHN KCP pricing documentation needed",
      "publisher": "NHN KCP",
      "url": null,
      "accessed_at": null,
      "reliability": "unknown",
      "notes": "Add direct official KCP URL before storing rates."
    }
  ],
  "version_history": [
    {
      "version": "0.1.0",
      "released_at": "2026-06-15",
      "changes": [
        "Initial starter economics dataset shell."
      ]
    },
    {
      "version": "0.2.0",
      "released_at": "2026-06-15",
      "changes": [
        "Added source-backed verification status and official-source references.",
        "Materialized representative official values where public sources were confirmed.",
        "Kept unverified or account-specific values as starter/null to prevent unsafe agent use."
      ]
    }
  ]
}
