{
  "schema_version": "0.1.0",
  "dataset_type": "marketplace",
  "provider": {
    "id": "smartstore",
    "name": "Naver Smartstore",
    "category": "marketplace",
    "country_codes": [
      "KR"
    ]
  },
  "coverage": {
    "markets": [
      "KR"
    ],
    "currency": "KRW",
    "status": "starter"
  },
  "fee_structures": [
    {
      "id": "npay-and-sales-fees",
      "name": "Npay and sales fee rules",
      "status": "starter",
      "basis": "Fee type and merchant sales band",
      "value": null,
      "conditions": [
        "Official topic exists; exact current rates not stored."
      ],
      "source_ref_ids": [
        "naver-smartstore-settlement-help"
      ],
      "notes": "Keep unverified until exact official rate table is added."
    }
  ],
  "settlement_rules": [
    {
      "id": "seller-settlement",
      "name": "Seller settlement timing",
      "status": "starter",
      "basis": "SmartStore settlement policy",
      "value": null,
      "conditions": [
        "Requires exact official settlement article extraction."
      ],
      "source_ref_ids": [
        "naver-smartstore-settlement-help"
      ],
      "notes": "Not materialized."
    }
  ],
  "shipping_costs": [
    {
      "id": "seller-shipping-cost",
      "name": "Seller shipping cost",
      "status": "starter",
      "basis": "Seller shipping template and carrier policy",
      "value": null,
      "conditions": [
        "Seller configured."
      ],
      "source_ref_ids": [
        "naver-smartstore-settlement-help"
      ],
      "notes": "No fixed rate."
    }
  ],
  "return_costs": [
    {
      "id": "return-shipping-cost",
      "name": "Return shipping cost",
      "status": "starter",
      "basis": "Return reason and seller shipping template",
      "value": null,
      "conditions": [
        "Seller configured."
      ],
      "source_ref_ids": [
        "naver-smartstore-settlement-help"
      ],
      "notes": "No fixed rate."
    }
  ],
  "metadata": {
    "version": "0.1.0",
    "status": "starter",
    "license": "Apache-2.0",
    "last_reviewed": "2026-06-15",
    "maintainers": [
      "Solverine"
    ],
    "ai_usage_notes": "Use only rules whose status is reviewed or draft with official source references. Do not infer missing category, settlement, shipping, return, or advertising values.",
    "verified_scope": "Official SmartStore settlement/help area referenced, but no machine-extracted fee table is materialized yet."
  },
  "source_references": [
    {
      "id": "naver-smartstore-settlement-help",
      "title": "Naver SmartStore settlement help",
      "publisher": "Naver SmartStore",
      "url": "https://help.sell.smartstore.naver.com/faq/list.help?categoryId=571",
      "accessed_at": "2026-06-15",
      "reliability": "official",
      "notes": "Official help center lists settlement and fee topics; exact fee rates need targeted extraction or account-side verification."
    }
  ],
  "version_history": [
    {
      "version": "0.1.0",
      "released_at": "2026-06-15",
      "changes": [
        "Initial starter economics dataset shell."
      ]
    },
    {
      "version": "0.2.0",
      "released_at": "2026-06-15",
      "changes": [
        "Added source-backed verification status and official-source references.",
        "Materialized representative official values where public sources were confirmed.",
        "Kept unverified or account-specific values as starter/null to prevent unsafe agent use."
      ]
    }
  ]
}
