{
  "schema_version": "0.1.0",
  "dataset_type": "logistics",
  "provider": {
    "id": "cj",
    "name": "CJ Logistics",
    "category": "logistics",
    "country_codes": [
      "KR"
    ]
  },
  "coverage": {
    "markets": [
      "KR"
    ],
    "currency": "KRW",
    "status": "draft"
  },
  "fee_structures": [
    {
      "id": "parcel-price-lookup",
      "name": "Parcel price lookup",
      "status": "draft",
      "basis": "Origin, destination, size, weight, and product value",
      "value": {
        "type": "calculator_reference",
        "size_rules": [
          {
            "size": "XS",
            "sum_cm": 80,
            "weight_kg": 2
          },
          {
            "size": "S",
            "sum_cm": 100,
            "weight_kg": 5
          }
        ]
      },
      "conditions": [
        "Actual fee must be calculated by origin/destination and parcel details."
      ],
      "source_ref_ids": [
        "cj-parcel-price"
      ],
      "notes": "Official calculator source, not a static tariff table."
    }
  ],
  "settlement_rules": [
    {
      "id": "carrier-billing",
      "name": "Carrier billing cycle",
      "status": "starter",
      "basis": "Carrier contract and invoicing policy",
      "value": null,
      "conditions": [
        "Contract-specific."
      ],
      "source_ref_ids": [
        "cj-parcel-price"
      ],
      "notes": "Not verified."
    }
  ],
  "shipping_costs": [
    {
      "id": "domestic-shipping",
      "name": "Domestic shipping cost",
      "status": "draft",
      "basis": "Parcel size, weight, origin/destination, and product value",
      "value": {
        "type": "calculator_reference"
      },
      "conditions": [
        "Use official lookup before quoting a price."
      ],
      "source_ref_ids": [
        "cj-parcel-price"
      ],
      "notes": "Official lookup source."
    }
  ],
  "return_costs": [
    {
      "id": "return-pickup",
      "name": "Return pickup cost",
      "status": "starter",
      "basis": "Return pickup policy and contract",
      "value": null,
      "conditions": [
        "Return pickup may differ from outbound shipping."
      ],
      "source_ref_ids": [
        "cj-parcel-price"
      ],
      "notes": "Not verified."
    }
  ],
  "metadata": {
    "version": "0.1.0",
    "status": "draft",
    "license": "Apache-2.0",
    "last_reviewed": "2026-06-15",
    "maintainers": [
      "Solverine"
    ],
    "ai_usage_notes": "Use only rules whose status is reviewed or draft with official source references. Do not infer missing category, settlement, shipping, return, or advertising values.",
    "verified_scope": "Official parcel-rate calculator source and package-size rules. Exact calculated prices are not stored."
  },
  "source_references": [
    {
      "id": "cj-parcel-price",
      "title": "CJ Logistics parcel price lookup",
      "publisher": "CJ Logistics",
      "url": "https://www.cjlogistics.com/ko/utility/parcel-price",
      "accessed_at": "2026-06-15",
      "reliability": "official",
      "notes": ""
    }
  ],
  "version_history": [
    {
      "version": "0.1.0",
      "released_at": "2026-06-15",
      "changes": [
        "Initial starter economics dataset shell."
      ]
    },
    {
      "version": "0.2.0",
      "released_at": "2026-06-15",
      "changes": [
        "Added source-backed verification status and official-source references.",
        "Materialized representative official values where public sources were confirmed.",
        "Kept unverified or account-specific values as starter/null to prevent unsafe agent use."
      ]
    }
  ]
}
