{
  "schema_version": "0.1.0",
  "dataset_type": "payments",
  "provider": {
    "id": "kg",
    "name": "KG Inicis",
    "category": "payments",
    "country_codes": [
      "KR"
    ]
  },
  "coverage": {
    "markets": [
      "KR"
    ],
    "currency": "KRW",
    "status": "draft"
  },
  "fee_structures": [
    {
      "id": "payment-processing-fees",
      "name": "Payment processing fees",
      "status": "draft",
      "basis": "Payment method; VAT excluded; merchant can differ",
      "value": {
        "type": "payment_fee_table",
        "currency": "KRW",
        "examples": [
          {
            "method": "credit_card",
            "rate_min": 3.0,
            "rate_max": 3.5
          },
          {
            "method": "bank_transfer",
            "rate_min": 1.8,
            "rate_max": 2.0,
            "minimum_fee": 200
          },
          {
            "method": "virtual_account",
            "fixed_fee": 300
          },
          {
            "method": "mobile_physical_goods",
            "rate": 3.5
          },
          {
            "method": "mobile_content",
            "rate": 7.0
          },
          {
            "method": "simple_payment_group_1",
            "rate_min": 3.0,
            "rate_max": 3.5
          },
          {
            "method": "simple_payment_group_2",
            "rate_min": 3.3,
            "rate_max": 3.5
          },
          {
            "method": "apple_pay",
            "rate": 3.5
          },
          {
            "method": "gift_certificate",
            "rate": 11.0
          }
        ]
      },
      "conditions": [
        "VAT excluded; overseas card and global payments require separate agreement."
      ],
      "source_ref_ids": [
        "kg-inicis-payment-method-fees"
      ],
      "notes": "Official KG Inicis table."
    }
  ],
  "settlement_rules": [
    {
      "id": "merchant-settlement",
      "name": "Merchant settlement timing",
      "status": "starter",
      "basis": "Payment method and merchant contract",
      "value": null,
      "conditions": [
        "Requires separate settlement source or contract."
      ],
      "source_ref_ids": [
        "kg-inicis-payment-method-fees"
      ],
      "notes": "Not materialized."
    }
  ],
  "shipping_costs": [
    {
      "id": "not-applicable",
      "name": "Shipping cost not applicable",
      "status": "draft",
      "basis": "Payment processor economics",
      "value": null,
      "conditions": [
        "Shipping costs are outside payment processing scope."
      ],
      "source_ref_ids": [
        "kg-inicis-payment-method-fees"
      ],
      "notes": "Common dataset compatibility placeholder."
    }
  ],
  "return_costs": [
    {
      "id": "refund-processing-cost",
      "name": "Refund or cancellation processing cost",
      "status": "starter",
      "basis": "Payment method and refund policy",
      "value": null,
      "conditions": [
        "Refund fee behavior requires a dedicated source."
      ],
      "source_ref_ids": [
        "kg-inicis-payment-method-fees"
      ],
      "notes": "Not materialized."
    }
  ],
  "metadata": {
    "version": "0.1.0",
    "status": "draft",
    "license": "Apache-2.0",
    "last_reviewed": "2026-06-15",
    "maintainers": [
      "Solverine"
    ],
    "ai_usage_notes": "Use only rules whose status is reviewed or draft with official source references. Do not infer missing category, settlement, shipping, return, or advertising values.",
    "verified_scope": "Official KG Inicis payment-method fee table."
  },
  "source_references": [
    {
      "id": "kg-inicis-payment-method-fees",
      "title": "KG Inicis payment method fees",
      "publisher": "KG Inicis",
      "url": "https://www.inicis.com/pg-method",
      "accessed_at": "2026-06-15",
      "reliability": "official",
      "notes": ""
    }
  ],
  "version_history": [
    {
      "version": "0.1.0",
      "released_at": "2026-06-15",
      "changes": [
        "Initial starter economics dataset shell."
      ]
    },
    {
      "version": "0.2.0",
      "released_at": "2026-06-15",
      "changes": [
        "Added source-backed verification status and official-source references.",
        "Materialized representative official values where public sources were confirmed.",
        "Kept unverified or account-specific values as starter/null to prevent unsafe agent use."
      ]
    }
  ]
}
